{
  "offlineTxId": "otx_a1b2c3d4e5f6",
  "authId": "auth_4a4c917bf87f",
  "sessionId": "sess_b3c4d5e6",
  "userId": "sub_e4d3c2b1a0f9e8d7c6b5a4938271e4d3",
  "bayId": "bay_f6e5d4c3b2a10987",
  "serviceId": "svc_eco",
  "startedAt": "2026-03-01T14:30:00.000Z",
  "endedAt": "2026-03-01T14:45:00.000Z",
  "durationSeconds": 900,
  "creditsCharged": 50,
  "receipt": {
    "data": "eyJhdXRoSWQiOiJhdXRoXzRhNGM5MTdiZjg3ZiIsImJheUlkIjoiYmF5X2Y2ZTVkNGMzYjJhMTA5ODciLCJjcmVkaXRzQ2hhcmdlZCI6NTAsImRldmljZUlkIjoiZGV2X2ExYjJjM2Q0IiwiZHVyYXRpb25TZWNvbmRzIjo5MDAsImVuZGVkQXQiOiIyMDI2LTAzLTAxVDE0OjQ1OjAwLjAwMFoiLCJvZmZsaW5lVHhJZCI6Im90eF9hMWIyYzNkNGU1ZjYiLCJzZXJ2aWNlSWQiOiJzdmNfZWNvIiwic2Vzc2lvbklkIjoic2Vzc19iM2M0ZDVlNiIsInN0YXJ0ZWRBdCI6IjIwMjYtMDMtMDFUMTQ6MzA6MDAuMDAwWiIsInR4Q291bnRlciI6MywidXNlcklkIjoic3ViX2U0ZDNjMmIxYTBmOWU4ZDdjNmI1YTQ5MzgyNzFlNGQzIn0=",
    "signature": "MEUCIQCeZDAyz9ra1b4088Iy/o8+/4pG2FuSM6z+Kcwjtm2dUwIgeMlsPc1Ak/bGYcS1JGLegtIsDue5w4kmKGaxUB5OD2o=",
    "signatureAlgorithm": "ECDSA-P256-SHA256"
  },
  "txCounter": 3
}
