{
  "offlineTxId": "otx_a1b2c3d4e5f67890",
  "offlinePassId": "opass_a1b2c3d4e5f67890",
  "passCounter": 44,
  "userId": "sub_alice2026",
  "bayId": "bay_a1b2c3d4e5f67890",
  "serviceId": "svc_eco",
  "startedAt": "2026-02-13T10:00:00.000Z",
  "endedAt": "2026-02-13T10:05:00.000Z",
  "durationSeconds": 300,
  "creditsCharged": 500,
  "receipt": {
    "data": "eyJiYXlJZCI6ImJheV9hMWIyYzNkNGU1ZjY3ODkwIiwiY3JlZGl0c0NoYXJnZWQiOjUwMCwiZGV2aWNlSWQiOiJkZXZfYTFiMmMzZDQiLCJkdXJhdGlvblNlY29uZHMiOjMwMCwiZW5kZWRBdCI6IjIwMjYtMDItMTNUMTA6MDU6MDAuMDAwWiIsIm9mZmxpbmVQYXNzSWQiOiJvcGFzc19hMWIyYzNkNGU1ZjY3ODkwIiwib2ZmbGluZVR4SWQiOiJvdHhfYTFiMmMzZDRlNWY2Nzg5MCIsInBhc3NDb3VudGVyIjo0NCwic2VydmljZUlkIjoic3ZjX2VjbyIsInN0YXJ0ZWRBdCI6IjIwMjYtMDItMTNUMTA6MDA6MDAuMDAwWiIsInR4Q291bnRlciI6MSwidXNlcklkIjoic3ViX2FsaWNlMjAyNiJ9",
    "signature": "MEUCIQD6dF/1tFOqVtWOs7djlycxF0tpcmLGUFHKyinykcp+BQIgStv0dguuEpwlmsjMsT+XOgz0nxS9ImalnCCuH3DOpE8=",
    "signatureAlgorithm": "ECDSA-P256-SHA256"
  },
  "txCounter": 1
}
